Title,Rating
A Light in the Attic,Three
Tipping the Velvet,One
Soumission,One
Sharp Objects,Four
Sapiens: A Brief History of Humankind,Five
The Requiem Red,One
The Dirty Little Secrets of Getting Your Dream Job,Four
"The Coming Woman: A Novel Based on the Life of the Infamous Feminist, Victoria Woodhull",Three
The Boys in the Boat: Nine Americans and Their Epic Quest for Gold at the 1936 Berlin Olympics,Four
The Black Maria,One
"Starving Hearts (Triangular Trade Trilogy, #1)",Two
Shakespeare's Sonnets,Four
Set Me Free,Five
Scott Pilgrim's Precious Little Life (Scott Pilgrim #1),Five
Rip it Up and Start Again,Five
"Our Band Could Be Your Life: Scenes from the American Indie Underground, 1981-1991",Three
Olio,One
Mesaerion: The Best Science Fiction Stories 1800-1849,One
Libertarianism for Beginners,Two
It's Only the Himalayas,Two
In Her Wake,One
How Music Works,Two
"Foolproof Preserving: A Guide to Small Batch Jams, Jellies, Pickles, Condiments, and More: A Foolproof Guide to Making Small Batch Jams, Jellies, Pickles, Condiments, and More",Three
Chase Me (Paris Nights #2),Five
Black Dust,Five
Birdsong: A Story in Pictures,Three
America's Cradle of Quarterbacks: Western Pennsylvania's Football Factory from Johnny Unitas to Joe Montana,Three
Aladdin and His Wonderful Lamp,Three
Worlds Elsewhere: Journeys Around Shakespeare’s Globe,Five
Wall and Piece,Four
The Four Agreements: A Practical Guide to Personal Freedom,Five
The Five Love Languages: How to Express Heartfelt Commitment to Your Mate,Three
The Elephant Tree,Five
The Bear and the Piano,One
Sophie's World,Five
Penny Maybe,Three
Maude (1883-1993):She Grew Up with the country,Two
"In a Dark, Dark Wood",One
Behind Closed Doors,Four
You can't bury them all: Poems,Two
Slow States of Collapse: Poems,Three
Reasons to Stay Alive,Two
Private Paris (Private #10),Five
#HigherSelfie: Wake Up Your Life. Free Your Soul. Find Your Tribe.,Five
Without Borders (Wanderlove #1),Two
When We Collided,One
"We Love You, Charlie Freeman",Five
Untitled Collection: Sabbath Poems 2014,Four
"Unseen City: The Majesty of Pigeons, the Discreet Charm of Snails & Other Wonders of the Urban Wilderness",Four
Unicorn Tracks,Three
"Unbound: How Eight Technologies Made Us Human, Transformed Society, and Brought Our World to the Brink",One
Tsubasa: WoRLD CHRoNiCLE 2 (Tsubasa WoRLD CHRoNiCLE #2),One
Throwing Rocks at the Google Bus: How Growth Became the Enemy of Prosperity,Three
This One Summer,Four
Thirst,Five
The Torch Is Passed: A Harding Family Story,One
The Secret of Dreadwillow Carse,One
"The Pioneer Woman Cooks: Dinnertime: Comfort Classics, Freezer Food, 16-Minute Meals, and Other Delicious Ways to Solve Supper!",One
The Past Never Ends,Four
The Natural History of Us (The Fine Art of Pretending #2),Three
The Nameless City (The Nameless City #1),Four
The Murder That Never Was (Forensic Instincts #5),Three
The Most Perfect Thing: Inside (and Outside) a Bird's Egg,Four
"The Mindfulness and Acceptance Workbook for Anxiety: A Guide to Breaking Free from Anxiety, Phobias, and Worry Using Acceptance and Commitment Therapy",Four
The Life-Changing Magic of Tidying Up: The Japanese Art of Decluttering and Organizing,Three
"The Inefficiency Assassin: Time Management Tactics for Working Smarter, Not Longer",Five
The Gutsy Girl: Escapades for Your Life of Epic Adventure,One
The Electric Pencil: Drawings from Inside State Hospital No. 3,One
The Death of Humanity: and the Case for Life,Four
"The Bulletproof Diet: Lose up to a Pound a Day, Reclaim Energy and Focus, Upgrade Your Life",Three
The Art Forger,Three
The Age of Genius: The Seventeenth Century and the Birth of the Modern Mind,One
The Activist's Tao Te Ching: Ancient Advice for a Modern Revolution,Five
Spark Joy: An Illustrated Master Class on the Art of Organizing and Tidying Up,Four
Soul Reader,Two
Security,Two
"Saga, Volume 6 (Saga (Collected Editions) #6)",Three
"Saga, Volume 5 (Saga (Collected Editions) #5)",Two
Reskilling America: Learning to Labor in the Twenty-First Century,Two
"Rat Queens, Vol. 3: Demons (Rat Queens (Collected Editions) #11-15)",Three
"Princess Jellyfish 2-in-1 Omnibus, Vol. 01 (Princess Jellyfish 2-in-1 Omnibus #1)",Five
Princess Between Worlds (Wide-Awake Princess #5),Five
"Pop Gun War, Volume 1: Gift",One
"Political Suicide: Missteps, Peccadilloes, Bad Calls, Backroom Hijinx, Sordid Pasts, Rotten Breaks, and Just Plain Dumb Mistakes in the Annals of American Politics",Two
Patience,Three
"Outcast, Vol. 1: A Darkness Surrounds Him (Outcast #1)",Four
orange: The Complete Collection 1 (orange: The Complete Collection #1),One
Online Marketing for Busy Authors: A Step-By-Step Guide,One
On a Midnight Clear,Three
Obsidian (Lux #1),Two
My Paris Kitchen: Recipes and Stories,Two
Masks and Shadows,Two
"Mama Tried: Traditional Italian Cooking for the Screwed, Crude, Vegan, and Tattooed",Four
"Lumberjanes, Vol. 2: Friendship to the Max (Lumberjanes #5-8)",Two
"Lumberjanes, Vol. 1: Beware the Kitten Holy (Lumberjanes #1-4)",Three
Lumberjanes Vol. 3: A Terrible Plan (Lumberjanes #9-12),Two
"Layered: Baking, Building, and Styling Spectacular Cakes",One
Judo: Seven Steps to Black Belt (an Introductory Guide for Beginners),Two
Join,Five
In the Country We Love: My Family Divided,Four
Immunity: How Elie Metchnikoff Changed the Course of Modern Medicine,Five
"I Hate Fairyland, Vol. 1: Madly Ever After (I Hate Fairyland (Compilations) #1-5)",Two
I am a Hero Omnibus Volume 1,Three
How to Be Miserable: 40 Strategies You Already Use,One
Her Backup Boyfriend (The Sorensen Family #1),One
"Giant Days, Vol. 2 (Giant Days #5-8)",Two
Forever and Forever: The Courtship of Henry Longfellow and Fanny Appleton,Three
First and First (Five Boroughs #3),Four
Fifty Shades Darker (Fifty Shades #2),One
Everydata: The Misinformation Hidden in the Little Data You Consume Every Day,Two
"Don't Be a Jerk: And Other Practical Advice from Dogen, Japan's Greatest Zen Master",Two
Danganronpa Volume 1,Four
Crown of Midnight (Throne of Glass #2),Three
"Codename Baboushka, Volume 1: The Conclave of Death",Four
Camp Midnight,Four
Call the Nurse: True Stories of a Country Nurse on a Scottish Isle,Five
Burning,Three
Bossypants,Two
"Bitch Planet, Vol. 1: Extraordinary Machine (Bitch Planet (Collected Editions))",Two
"Avatar: The Last Airbender: Smoke and Shadow, Part 3 (Smoke and Shadow #3)",Two
Algorithms to Live By: The Computer Science of Human Decisions,One
A World of Flavor: Your Gluten Free Passport,One
"A Piece of Sky, a Grain of Rice: A Memoir in Four Meditations",Five
A Murder in Time,One
A Flight of Arrows (The Pathfinders #2),Five
A Fierce and Subtle Poison,Four
A Court of Thorns and Roses (A Court of Thorns and Roses #1),One
(Un)Qualified: How God Uses Broken People to Do Big Things,Five
You Are What You Love: The Spiritual Power of Habit,Four
"William Shakespeare's Star Wars: Verily, A New Hope (William Shakespeare's Star Wars #4)",Four
Tuesday Nights in 1980,Two
Tracing Numbers on a Train,Three
Throne of Glass (Throne of Glass #1),Three
Thomas Jefferson and the Tripoli Pirates: The Forgotten War That Changed American History,One
Thirteen Reasons Why,One
The White Cat and the Monk: A Retelling of the Poem “Pangur Bán”,Four
The Wedding Dress,One
The Vacationers,Four
The Third Wave: An Entrepreneur’s Vision of the Future,Five
The Stranger,Four
The Shadow Hero (The Shadow Hero),One
The Secret (The Secret #1),Four
The Regional Office Is Under Attack!,Five
The Psychopath Test: A Journey Through the Madness Industry,Two
The Project,One
The Power of Now: A Guide to Spiritual Enlightenment,Two
The Omnivore's Dilemma: A Natural History of Four Meals,Two
The Nerdy Nummies Cookbook: Sweet Treats for the Geek in All of Us,Five
The Murder of Roger Ackroyd (Hercule Poirot #4),Four
The Mistake (Off-Campus #2),Three
The Matchmaker's Playbook (Wingmen Inc. #1),One
The Love and Lemons Cookbook: An Apple-to-Zucchini Celebration of Impromptu Cooking,Two
The Long Shadow of Small Ghosts: Murder and Memory in an American City,One
The Kite Runner,Four
The House by the Lake,One
The Glittering Court (The Glittering Court #1),One
The Girl on the Train,Two
The Genius of Birds,One
The Emerald Mystery,Two
The Cookies & Cups Cookbook: 125+ sweet & savory recipes reminding you to Always Eat Dessert First,One
The Bridge to Consciousness: I'm Writing the Bridge Between Science and Our Old and New Beliefs.,Three
The Artist's Way: A Spiritual Path to Higher Creativity,Five
The Art of War,Five
The Argonauts,Two
The 10% Entrepreneur: Live Your Startup Dream Without Quitting Your Day Job,Three
Suddenly in Love (Lake Haven #1),Two
Something More Than This,Four
Soft Apocalypse,Two
So You've Been Publicly Shamed,Two
Shoe Dog: A Memoir by the Creator of NIKE,Two
"Shobu Samurai, Project Aryoku (#3)",Three
Secrets and Lace (Fatal Hearts #1),One
Scarlett Epstein Hates It Here,Five
Romero and Juliet: A Tragic Tale of Love and Zombies,One
Redeeming Love,Five
Poses for Artists Volume 1 - Dynamic and Sitting Poses: An Essential Reference for Figure Drawing and the Human Form,One
Poems That Make Grown Women Cry,Four
"Nightingale, Sing",One
Night Sky with Exit Wounds,One
Mrs. Houdini,Five
Modern Romance,Five
Miss Peregrine’s Home for Peculiar Children (Miss Peregrine’s Peculiar Children #1),One
Louisa: The Extraordinary Life of Mrs. Adams,Two
Little Red,Three
Library of Souls (Miss Peregrine’s Peculiar Children #3),Five
Large Print Heart of the Pride,Two
I Had a Nice Time And Other Lies...: How to find love & sh*t like that,Four
Hollow City (Miss Peregrine’s Peculiar Children #2),One
Grumbles,Two
Full Moon over Noah’s Ark: An Odyssey to Mount Ararat and Beyond,Four
Frostbite (Vampire Academy #2),Five
Follow You Home,One
First Steps for New Christians (Print Edition),One
Finders Keepers (Bill Hodges Trilogy #2),Five
"Fables, Vol. 1: Legends in Exile (Fables #1)",Four
Eureka Trivia 6.0,Four
Drive: The Surprising Truth About What Motivates Us,Four
Done Rubbed Out (Reightman & Bailey #1),Five
Doing It Over (Most Likely To #1),Three
"Deliciously Ella Every Day: Quick and Easy Recipes for Gluten-Free Snacks, Packed Lunches, and Simple Meals",Three
Dark Notes,Five
"Daring Greatly: How the Courage to Be Vulnerable Transforms the Way We Live, Love, Parent, and Lead",Three
Close to You,Four
Chasing Heaven: What Dying Taught Me About Living,Two
Big Magic: Creative Living Beyond Fear,Three
Becoming Wise: An Inquiry into the Mystery and Art of Living,Two
Beauty Restored (Riley Family Legacy Novellas #3),Two
Batman: The Long Halloween (Batman),Two
Batman: The Dark Knight Returns (Batman),Five
Ayumi's Violin,Two
Anonymous,Four
Amy Meets the Saints and Sages,Three
Amid the Chaos,One
Amatus,Five
Agnostic: A Spirited Manifesto,Five
Zealot: The Life and Times of Jesus of Nazareth,Three
You (You #1),Five
"Wonder Woman: Earth One, Volume One (Wonder Woman: Earth One #1)",Four
Wild Swans,Two
Why the Right Went Wrong: Conservatism--From Goldwater to the Tea Party and Beyond,Four
Whole Lotta Creativity Going On: 60 Fun and Unusual Exercises to Awaken and Strengthen Your Creativity,Four
What's It Like in Space?: Stories from Astronauts Who've Been There,Two
"We Are Robin, Vol. 1: The Vigilante Business (We Are Robin #1)",One
Walt Disney's Alice in Wonderland,Five
V for Vendetta (V for Vendetta Complete),Four
Until Friday Night (The Field Party #1),Two
"Unbroken: A World War II Story of Survival, Resilience, and Redemption",Two
Twenty Yawns,Two
Through the Woods,Two
This Is Where It Ends,Two
The Year of Magical Thinking,Two
The Wright Brothers,Four
The White Queen (The Cousins' War #1),Five
The Wedding Pact (The O'Malleys #2),Three
The Time Keeper,Five
The Testament of Mary,Four
The Star-Touched Queen,Five
The Songs of the Gods,Five
The Song of Achilles,Five
The Rosie Project (Don Tillman #1),One
The Power of Habit: Why We Do What We Do in Life and Business,Three
The Marriage of Opposites,Four
The Lucifer Effect: Understanding How Good People Turn Evil,One
The Long Haul (Diary of a Wimpy Kid #9),One
The Loney,One
The Literature Book (Big Ideas Simply Explained),Three
The Last Mile (Amos Decker #2),Two
The Immortal Life of Henrietta Lacks,Two
The Hidden Oracle (The Trials of Apollo #1),Two
The Help Yourself Cookbook for Kids: 60 Easy Plant-Based Recipes Kids Can Make to Stay Healthy and Save the Earth,Three
The Guilty (Will Robie #4),Two
The First Hostage (J.B. Collins #2),Three
The Dovekeepers,One
The Darkest Lie,Five
The Bane Chronicles (The Bane Chronicles #1-11),Four
The Bad-Ass Librarians of Timbuktu: And Their Race to Save the World’s Most Precious Manuscripts,One
The 14th Colony (Cotton Malone #11),One
That Darkness (Gardiner and Renner #1),One
Tastes Like Fear (DI Marnie Rome #3),One
Take Me with You,Three
Swell: A Year of Waves,One
Superman Vol. 1: Before Truth (Superman by Gene Luen Yang #1),Five
Still Life with Bread Crumbs,Three
Steve Jobs,Five
Sorting the Beef from the Bull: The Science of Food Fraud Forensics,Four
Someone Like You (The Harrisons #2),Five
"So Cute It Hurts!!, Vol. 6 (So Cute It Hurts!! #6)",Four
Shtum,Four
See America: A Celebration of Our National Parks & Treasured Sites,Three
salt.,Four
Robin War,Three
"Red Hood/Arsenal, Vol. 1: Open for Business (Red Hood/Arsenal #1)",Two
Rain Fish,Three
"Quarter Life Poetry: Poems for the Young, Broke and Hangry",Five
Pet Sematary,Three
"Overload: How to Unplug, Unwind, and Unleash Yourself from the Pressure of Stress",Three
Once Was a Time,Two
Old School (Diary of a Wimpy Kid #10),Five
No Dream Is Too High: Life Lessons From a Man Who Walked on the Moon,Two
"Naruto (3-in-1 Edition), Vol. 14: Includes Vols. 40, 41 & 42 (Naruto: Omnibus #14)",Two
My Name Is Lucy Barton,One
My Mrs. Brown,Three
My Kind of Crazy,One
Mr. Mercedes (Bill Hodges Trilogy #1),One
More Than Music (Chasing the Dream #1),Two
Made to Stick: Why Some Ideas Survive and Others Die,Five
Luis Paints the World,Three
Luckiest Girl Alive,Three
Lowriders to the Center of the Earth (Lowriders in Space #2),Two
Love Is a Mix Tape (Music #1),One
Looking for Lovely: Collecting the Moments that Matter,Five
"Living Leadership by Insight: A Good Leader Achieves, a Great Leader Builds Monuments",Four
Let It Out: A Journey Through Journaling,Five
Lady Midnight (The Dark Artifices #1),Five
"It's All Easy: Healthy, Delicious Weeknight Meals in under 30 Minutes",One
Island of Dragons (Unwanteds #7),One
I Know What I'm Doing -- and Other Lies I Tell Myself: Dispatches from a Life Under Construction,Four
I Am Pilgrim (Pilgrim #1),Four
"Hyperbole and a Half: Unfortunate Situations, Flawed Coping Mechanisms, Mayhem, and Other Things That Happened",Five
"Hush, Hush (Hush, Hush #1)",Three
Hold Your Breath (Search and Rescue #1),One
Hamilton: The Revolution,Three
Greek Mythic History,Five
God: The Most Unpleasant Character in All Fiction,Five
Glory over Everything: Beyond The Kitchen House,Three
Feathers: Displays of Brilliant Plumage,Three
"Far & Away: Places on the Brink of Change: Seven Continents, Twenty-Five Years",Four
Every Last Word,Three
Eligible (The Austen Project #4),Three
El Deafo,Five
Eight Hundred Grapes,Four
"Eaternity: More than 150 Deliciously Easy Vegan Recipes for a Long, Healthy, Satisfied, Joyful Life",Five
"Eat Fat, Get Thin",Two
Don't Get Caught,One
Doctor Sleep (The Shining #2),Two
Demigods & Magicians: Percy and Annabeth Meet the Kanes (Percy Jackson & Kane Chronicles Crossover #1-3),Five
Dear Mr. Knightley,Five
Daily Fantasy Sports,One
Crazy Love: Overwhelmed by a Relentless God,Two
Cometh the Hour (The Clifton Chronicles #6),Three
Code Name Verity (Code Name Verity #1),Four
Clockwork Angel (The Infernal Devices #1),One
City of Glass (The Mortal Instruments #3),Four
City of Fallen Angels (The Mortal Instruments #4),Four
City of Bones (The Mortal Instruments #1),One
City of Ashes (The Mortal Instruments #2),One
Cell,Four
Catching Jordan (Hundred Oaks),Three
"Carry On, Warrior: Thoughts on Life Unarmed",Three
Carrie,Two
Buying In: The Secret Dialogue Between What We Buy and Who We Are,Four
Brain on Fire: My Month of Madness,Five
Batman: Europa,Two
Barefoot Contessa Back to Basics,One
Barefoot Contessa at Home: Everyday Recipes You'll Make Over and Over Again,Five
Balloon Animals,Three
Art Ops Vol. 1,Three
Aristotle and Dante Discover the Secrets of the Universe (Aristotle and Dante Discover the Secrets of the Universe #1),Four
Angels Walking (Angels Walking #1),Two
Angels & Demons (Robert Langdon #1),Three
All the Light We Cannot See,Five
"Adulthood Is a Myth: A ""Sarah's Scribbles"" Collection",Two
Abstract City,Five
A Time of Torment (Charlie Parker #14),Five
A Study in Scarlet (Sherlock Holmes #1),Two
"A Series of Catastrophes and Miracles: A True Story of Love, Science, and Cancer",Two
A People's History of the United States,Two
A Man Called Ove,One
A Distant Mirror: The Calamitous 14th Century,Three
A Brush of Wings (Angels Walking #3),One
1491: New Revelations of the Americas Before Columbus,Three
"The Three Searches, Meaning, and the Story",Three
Searching for Meaning in Gailana,One
Rook,Four
My Kitchen Year: 136 Recipes That Saved My Life,Two
13 Hours: The Inside Account of What Really Happened In Benghazi,One
Will You Won't You Want Me?,Three
Tipping Point for Planet Earth: How Close Are We to the Edge?,One
The Star-Touched Queen,Five
The Silent Sister (Riley MacPherson #1),Five
The Midnight Watch: A Novel of the Titanic and the Californian,One
The Lonely City: Adventures in the Art of Being Alone,Two
The Gray Rhino: How to Recognize and Act on the Obvious Dangers We Ignore,Four
The Golden Condom: And Other Essays on Love Lost and Found,One
The Epidemic (The Program 0.6),Five
The Dinner Party,Two
The Diary of a Young Girl,Three
The Children,Three
Stars Above (The Lunar Chronicles #4.5),Two
Snatched: How A Drug Queen Went Undercover for the DEA and Was Kidnapped By Colombian Guerillas,Three
Raspberry Pi Electronics Projects for the Evil Genius,Four
Quench Your Own Thirst: Business Lessons Learned Over a Beer or Two,One
Psycho: Sanitarium (Psycho #1.5),Five
Poisonous (Max Revere Novels #3),Three
One with You (Crossfire #5),Four
No Love Allowed (Dodge Cove #1),Four
Murder at the 42nd Street Library (Raymond Ambler #1),Four
Most Wanted,Three
"Love, Lies and Spies",Two
How to Speak Golf: An Illustrated Guide to Links Lingo,Five
Hide Away (Eve Duncan #20),One
Furiously Happy: A Funny Book About Horrible Things,Four
Everyday Italian: 125 Simple and Delicious Recipes,Five
Equal Is Unfair: America's Misguided Fight Against Income Inequality,One
Eleanor & Park,Five
Dirty (Dive Bar #1),Four
Can You Keep a Secret? (Fear Street Relaunch #4),One
Boar Island (Anna Pigeon #19),Three
A Paris Apartment,Four
"A la Mode: 120 Recipes in 60 Pairings: Pies, Tarts, Cakes, Crisps, and More Topped with Ice Cream, Gelato, Frozen Custard, and More",One
Troublemaker: Surviving Hollywood and Scientology,Two
The Widow,Two
"The Sleep Revolution: Transforming Your Life, One Night at a Time",Four
The Improbability of Love,One
The Art of Startup Fundraising,Three
Take Me Home Tonight (Rock Star Romance #3),Three
Sleeping Giants (Themis Files #1),One
"Setting the World on Fire: The Brief, Astonishing Life of St. Catherine of Siena",Two
Playing with Fire,Three
Off the Hook (Fishing for Trouble #1),Three
Mothering Sunday,Two
"Mother, Can You Not?",Five
M Train,One
Lilac Girls,Two
Lies and Other Acts of Love,One
Lab Girl,One
Keep Me Posted,Four
It Didn't Start with You: How Inherited Family Trauma Shapes Who We Are and How to End the Cycle,Three
Grey (Fifty Shades #4),Four
"Exit, Pursued by a Bear",Four
Daredevils,Three
Cravings: Recipes for What You Want to Eat,Three
Born for This: How to Find the Work You Were Meant to Do,Five
Arena,Four
Adultery,Five
A Mother's Reckoning: Living in the Aftermath of Tragedy,Three
A Gentleman's Position (Society of Gentlemen #3),Five
11/22/63,Three
"10% Happier: How I Tamed the Voice in My Head, Reduced Stress Without Losing My Edge, and Found Self-Help That Actually Works",Two
10-Day Green Smoothie Cleanse: Lose Up to 15 Pounds in 10 Days!,Five
Without Shame,Five
Watchmen,Four
Unlimited Intuition Now,Four
Underlying Notes,Two
The Shack,One
The New Brand You: Your New Image Makes the Sale for You,Five
"The Moosewood Cookbook: Recipes from Moosewood Restaurant, Ithaca, New York",Four
The Flowers Lied,Two
"The Fabric of the Cosmos: Space, Time, and the Texture of Reality",One
The Book of Mormon,Three
The Art and Science of Low Carbohydrate Living,Five
The Alien Club,One
Suzie Snowflake: One beautiful flake (a self-esteem story),Five
Nap-a-Roo,One
"NaNo What Now? Finding your editing process, revising your NaNoWriMo book and building a writing career through publishing and beyond",Four
Modern Day Fables,Two
If I Gave You God's Phone Number....: Searching for Spirituality in America,One
"Fruits Basket, Vol. 9 (Fruits Basket #9)",Four
Dress Your Family in Corduroy and Denim,Three
Don't Forget Steven,One
Chernobyl 01:23:40: The Incredible True Story of the World's Worst Nuclear Disaster,Two
Art and Fear: Observations on the Perils (and Rewards) of Artmaking,Four
A Shard of Ice (The Black Symphony Saga #1),Three
A Hero's Curse (The Unseen Chronicles #1),Three
23 Degrees South: A Tropical Tale of Changing Whether...,Two
"Zero to One: Notes on Startups, or How to Build the Future",Three
Why Not Me?,One
When Breath Becomes Air,Two
Vagabonding: An Uncommon Guide to the Art of Long-Term World Travel,Two
The Unlikely Pilgrimage of Harold Fry (Harold Fry #1),Five
The New Drawing on the Right Side of the Brain,Three
"The Midnight Assassin: Panic, Scandal, and the Hunt for America's First Serial Killer",Four
The Martian (The Martian #1),Two
The High Mountains of Portugal,One
The Grownup,One
The E-Myth Revisited: Why Most Small Businesses Don't Work and What to Do About It,One
South of Sunshine,One
Smarter Faster Better: The Secrets of Being Productive in Life and Business,Five
Silence in the Dark (Logan Point #4),Three
Shadows of the Past (Logan Point #1),Five
Roller Girl,Five
Rising Strong,Three
Proofs of God: Classical Arguments from Tertullian to Barth,One
Please Kill Me: The Uncensored Oral History of Punk,Four
Out of Print: City Lights Spotlight No. 14,Five
My Life Next Door (My Life Next Door ),Five
Miller's Valley,Two
Man's Search for Meaning,Three
"Love That Boy: What Two Presidents, Eight Road Trips, and My Son Taught Me About a Parent's Expectations",Two
Living Forward: A Proven Plan to Stop Drifting and Get the Life You Want,Three
Les Fleurs du Mal,Five
Left Behind (Left Behind #1),Two
Kill 'Em and Leave: Searching for James Brown and the American Soul,Five
Kierkegaard: A Christian Missionary to Christians,One
John Vassos: Industrial Design for Modern Life,Four
I'll Give You the Sun,One
I Will Find You,One
Hystopia: A Novel,Four
Howl and Other Poems,Two
History of Beauty,Four
Heaven is for Real: A Little Boy's Astounding Story of His Trip to Heaven and Back,Two
Future Shock (Future Shock #1),Five
Ender's Game (The Ender Quintet #1),One
Diary of a Citizen Scientist: Chasing Tiger Beetles and Other New Ways of Engaging the World,One
Death by Leisure: A Cautionary Tale,Four
Brilliant Beacons: A History of the American Lighthouse,Three
Brazen: The Courage to Find the You That's Been Hiding,Two
Between the World and Me,Four
Being Mortal: Medicine and What Matters in the End,Four
"A Murder Over a Girl: Justice, Gender, Junior High",Three
32 Yolks,Two
"""Most Blessed of the Patriarchs"": Thomas Jefferson and the Empire of the Imagination",Five
You Are a Badass: How to Stop Doubting Your Greatness and Start Living an Awesome Life,Three
Wildlife of New York: A Five-Borough Coloring Book,Two
What Happened on Beale Street (Secrets of the South Mysteries #2),Five
Unreasonable Hope: Finding Faith in the God Who Brings Purpose to Your Pain,Two
Under the Tuscan Sun,Three
Toddlers Are A**holes: It's Not Your Fault,One
The Year of Living Biblically: One Man's Humble Quest to Follow the Bible as Literally as Possible,One
The Whale,Four
The Story of Art,Four
The Origin of Species,Four
The Great Gatsby,Four
The Good Girl,Three
The Glass Castle,One
The Faith of Christopher Hitchens: The Restless Soul of the World's Most Notorious Atheist,One
The Drowning Girls,Three
The Constant Princess (The Tudor Court #1),Three
The Bourne Identity (Jason Bourne #1),Four
The Bachelor Girl's Guide to Murder (Herringford and Watts Mysteries #1),Five
The Art Book,Two
The 7 Habits of Highly Effective People: Powerful Lessons in Personal Change,Four
Team of Rivals: The Political Genius of Abraham Lincoln,Five
Steal Like an Artist: 10 Things Nobody Told You About Being Creative,Two
"Sit, Stay, Love",Three
Sister Dear,Four
"Shrunken Treasures: Literary Classics, Short, Sweet, and Silly",Three
"Rich Dad, Poor Dad",One
Raymie Nightingale,Two
Playing from the Heart,One
Nightstruck: A Novel,Four
"Naturally Lean: 125 Nourishing Gluten-Free, Plant-Based Recipes--All Under 300 Calories",Five
Meternity,Three
Memoirs of a Geisha,Three
Like Never Before (Walker Family #2),Two
Life of Pi,Four
Leave This Song Behind: Teen Poetry at Its Best,Five
King's Folly (The Kinsman Chronicles #1),Five
John Adams,Four
How to Cook Everything Vegetarian: Simple Meatless Recipes for Great Food (How to Cook Everything),Four
How to Be a Domestic Goddess: Baking and the Art of Comfort Cooking,Two
Good in Bed (Cannie Shapiro #1),Five
"Fruits Basket, Vol. 7 (Fruits Basket #7)",One
For the Love: Fighting for Grace in a World of Impossible Standards,Three
Finding God in the Ruins: How God Redeems Pain,Two
Every Heart a Doorway (Every Heart A Doorway #1),Five
Delivering the Truth (Quaker Midwife Mystery #1),Four
Counted With the Stars (Out from Egypt #1),Five
"Chronicles, Vol. 1",Two
Blue Like Jazz: Nonreligious Thoughts on Christian Spirituality,One
Benjamin Franklin: An American Life,Three
